Yes,Other & Multiple,NOTE: Modeled using LDC proposal for prohibitions (except for their S&DT - used that from this proposal instead). Tranistion periods not modeled.,Need to identify developing countries meeting non-industrial criteria. The three options associated with defining it could be calculated on the back-end. Also double check some of the options here. ,India - S&DT,S&DT,6-Mar-20,TN/RL/GEN/200/Rev.1,Yes,India,Article [X]: Special and differential treatment,"This communication advocates for special and differential treatment for all three classes of proposed disciplines. As written, this proposal does not specify potential prohibitions within each of the three categories, but only the S&DT that should be allowed for developing countries. To model the possible effects of this proposal, we therefore use the prohibition disciplines proposed in the Comprehensive text proposal (excluding any S&DT).","<ol><li>Final determinations are made by existing RFMO/A vessel lists, by flag, subsidizing, and coastal Member states.</li><li>No publicly available data exist for most flag and subsidizing Members, nor for coastal Members. The possible effects of modeling this proposal is therefore a conservative interpretation of this text. Users are free to explore a more ambitious interpretation by making their own assumptions about the expected IUU-findings.</li><li>No proportionality or the duration of prohibition is considered.</li></ol>","Subsidies granted by developing and LDC Members shall be allowed for small scale fishing a) within their own territorial waters and on the high seas for 7 years. We include the S&DT for fishing in territorial waters, but do not model the transitional S&DT.  ","<ol><li>There is uncertainty regarding the status of many fish stocks.</li><li>For the purposes of modeling this proposal, we assume that subsidies to fishing on stocks identified as overfished (B/Bmsy < 1) in the RAM Legacy Stock Assessment Database are prohibited.</li><li>The proportion of stocks identified as overfished in the RAM Legacy Stock Assessment Database likely underestimates the actual proportion of stocks that are overfished globally, but it is unclear whether enough evidence would exist to trigger this prohibition for stocks not included in this database.</li><li>The proposal is ambiguous about which reference point might be used to make an overfished determination, and we therefore note that this is only one possible interpretation of this text.</li></ol>","Subsidies granted by developing and LDC Members shall be allowed for fishing a) within their own territorial waters and b) within their own EEZs for 2 years. We include the S&DT for fishing in territorial waters, but do not model the transitional S&DT. ","<ol><li>We assume that all capacity-enhancing and ambiguous subsidies as defined by Sumaila et al. (2019) are prohibited to vessels fishing on the high seas, and to vessels greater than 24 m in length or with a tonnage greater than 100 GT (we assume industrial fishing to be defined by the characteristics specified by OFOC – Vessel characteristics).</li></ol>","Subsidies granted by LDCs shall be allowed, and subsidies granted by developing countries shall be allowed for fishing in their territorial seas, or for fishing in their EEZs and on the high seas unless any of the following conditions are met for three consecutive years (2016-2018): a) GNI per capita is greater than US $5000 (constant 2010 US$), b) they engage in distant water fishing, or c) the contribution from Agriculture, Forestry and Fishing to their national GDP (World Bank) is greater than 10%.",No,"IUU1, IUU2, IUU3, IUU4",NO,,ALL,,,YES,YES,DOMESTIC,,YES,DOMESTIC,,NO,,,OA1,SELECT,ALL,,,,,,YES,YES,TER,,,YES,TER,,,NO,,,,"B1, B2, B3, B4, B5, B6, B7, C1, C2, C3",SELECT,"LENGTH, TONNAGE",,,24,100,,YES,YES,ALL,,,YES,TER,,,NO,,,,NO,,,,,,,,,,,,,,,,,,,,,,,
Yes,OFOC,"Rev.1 of the Brazil formula proposal. NOTE: As written, if a Member's baseline is lower than USD 25mn and the Member demonstrably needs to develop capacity to fish in their own EEZ, they shall be entitled an ""uplift"" of USD 5 mn (i.e., their subsidies limit shall be USD 30mn). The ""uplift"" shall last until one of the following conditions is met: the percentage of the fish caught within that Member's EEZ by vessels flying that Member's flag reaches 75 % of the total catch; or the Member has attained capacity to fish at MSY or alternative reference points within its own EEZ. The Member who benefits from the ""uplift"" shall notify, every two years, the percentage of fish caught in its EEZ by vessels carrying its flag. Every four years, the Member's exemption shall be reviewed. It is impossible to model a demonstrated need for developing capacity here, and thus this uplift is not modeled.  ","10/21/21 - Text updated. 5/13/21 - NEW. Pretty sure we can not model the S&DT ""uplift"" criteria here. Made this clear in the text. ",Brazil - Formula,CAP - Formula (Rev. 1),6-Oct-20,RD/TN/RL/124/Rev.1,No,Brazil,Mechanism for Reductions and Limits of Fisheries Subsidies (Rev. 1),"This communication proposes a quantitative approach of reductions and limits to maritime fisheries subsidies that is complementary to the main prohibition. The baseline of reductions is to be the annual average monetary value of fisheries subsidies (3 prior years or 1 year -optional) minus exempted subsidies (cessation, stock protection, artisanal fishing in 12nm zone, disaster relief). It specifies cumulative ranges (8 ranges: $0-15 million USD to over $1.2 billion USD) of subsidies in monetary value. Members falling in each range will be subject to a specific percentage reduction in total fisheries subsidies (from 0% to 15% and then to 45% in increments of 5). The total subsidy reduction shall equal the sum of the cuts on each range; the upper ranges carry larger reduction obligations. The proposal contains a default option of $25 million USD in cases where a Member fails to notify to establish the baseline. It also provides for a flexibility for Members with a baseline below $25 million USD that could be uplifted by $5 million USD under certain conditions (timebound, MSY and capture limit). ",None</br>,N/A,None</br>,N/A,None</br>,N/A,"<ol><li>We assume each Member's baseline to the total magnitude of capacity-enhancing subsidies estimated by Sumaila et al. (2019).</li><li>The formula ranges and percentages of reduction from the proposal are then applied to all Members.</li><li>The""uplift"" allowance for Members demonstrating a need to develop capacity within their own EEZ cannot be modeled here, thus this proposal is functionally equivalent to the earlier version.</li></ol>",,,,,,,NO,,,,,,,,,,,,,,,,,,NO,,,,,,,,,,,,,,,,,,,,,NO,,,,,,,,,,,,,YES,"B1, B2, B3, B4, B5, B6, B7",ONE,,,,BRAZIL,,,,,,,,,,,,,,,,,
Yes,Other & Multiple,"Blank entry for Chair's text. NOTE: As written, this proposal places different prohibitions on boat building/fuel subsidies and all other subsidies. The prohibition on the former would only apply on the high seas, while the latter would apply to all. This is not accounted for here are we assume them both to only apply to high seas fishing.",10/21/21 - Text updated. 5/13/21 - Text updated. ,Chair's text - Consolidated text,Chair's text - Consolidated text (Dec 2020),18-Dec-20,RD/TN/RL/126/Rev.2,No,Chair's draft consolidated text,Draft consolidated text (Dec 2020),"This communication aims to consolidate all existing texts that have been put forth or discussed with regards to a prohibition on subsidies. It was intended to provide a starting point for interactive discussion. As written, it provides two possible ways of characterizing and determining what constitutes an overfished stock: i) those recognized as such by the Member under whose jurisdiction the fishing is taking place or by the relevant RFMO/A; ii) those for which the mortality from fishing needs to be restricted to allow the stock to rebuild to some reference point. Additionally, it includes a blank placeholder for inclusion of a cap-based proposal.",,,,,,,,,,,,,,,,,,,,,,,,,,,,,,,,,,,,,,,,,,,,,,,,,,,,,,,,,,,,,,,,,,,,,,,,,,,,,,,,,,,,,,,,,
Alternate,Other & Multiple,Chair's text + More ambitious overfished ,10/21/21 - Text updated. - NEED GNI/OTHER FOR OCOF 5/13/21 - Text updated. ,Chair's text - Consolidated text,Chair's text - Consolidated text (Dec 2020) [Objective Definition],18-Dec-20,RD/TN/RL/126/Rev.2 | Objective Definition,No,Chair's draft consolidated text,Draft consolidated text (Dec 2020),"This communication aims to consolidate all existing texts that have been put forth or discussed with regards to a prohibition on subsidies. It was intended to provide a starting point for interactive discussion. As written, it provides two possible ways of characterizing and determining what constitutes an overfished stock: i) those recognized as such by the Member under whose jurisdiction the fishing is taking place or by the relevant RFMO/A; ii) those for which the mortality from fishing needs to be restricted to allow the stock to rebuild to some reference point. Additionally, it includes a blank placeholder for inclusion of a cap-based proposal.","<ol><li>Final determinations are made by existing RFMO/A vessel lists, by flag, subsidizing, coastal, and port Member states.</li><li>No publicly available data exist for most flag and subsidizing Members, nor for coastal Members. The possible effects of modeling this proposal is therefore a conservative interpretation of this text. Users are free to explore a more ambitious interpretation by making their own assumptions about the expected IUU-findings.</li><li>No proportionality or the duration of prohibition is considered.</li></ol> ",Subsidies granted by developing and LDC Members shall be allowed for small-scale fishing within their own territorial waters.,"<ol><li>There is uncertainty regarding the status of many fish stocks.</li><li>For the purposes of modeling this proposal, we assume that subsidies to fishing on stocks identified as overfished (B/Bmsy < 1) in the RAM Legacy Stock Assessment Database are prohibited.</li><li>The proportion of stocks identified as overfished in the RAM Legacy Stock Assessment Database likely underestimates the actual proportion of stocks that are overfished globally, but it is unclear whether enough evidence would exist to trigger this prohibition for stocks not included in this database.</li><li>The proposal is ambiguous about which reference point might be used to make an overfished determination, and we therefore note that this is only one possible interpretation of this text.</li><li>Additionally, as written, this text includes two alternative definitions used to identify an overfished stock - this is the more ambitious interpretation of the two (see OFOC - Negative effects (Option A)).</li></ol>",Subsidies granted by developing and LDC Members shall be allowed for fishing within their own territorial waters.,"<ol><li>We assume that all capacity-enhancing and ambiguous subsidies as defined by Sumaila et al. (2019) are prohibited to vessels fishing in areas beyond that Member's national jurisdiction.</li><li>We note that this is an ambitious interpretation of this proposal, as the text makes it clear that the fact that a subsidy is granted is not reason enough for that subsidy to be prohibited. However, data does not exist at present to make this determination for subsidy programs globally.</li><li>By default, we consider all capacity-enhancing subsidies provided to vessels spending at least 5% of their total annual effort fishing on the high seas and/or in the EEZs of another coastal state to be prohibited.</li></ol>","Subsidies granted by LDCs shall be allowed, and subsidies granted by developing countries shall be allowed for fishing in their territorial seas, or for fishing in their EEZs and high seas unless any of the following conditions are met for three consecutive years (2016-2018): a) GNI per capita is greater than US $5000 (constant 2010 US$), b) they engage in distant water fishing, or c) the contribution from Agriculture, Forestry and Fishing to their national GDP (World Bank) is greater than 10%.",No,"IUU1, IUU2, IUU3, IUU4, IUU5",NO,,ALL,,,YES,YES,TER,,YES,TER,,NO,,,OA1,SELECT,ALL,,,,,,YES,YES,TER,,,YES,TER,,,NO,,,,"B1, B2, B3, B4, B5, B6, B7, C1, C2, C3",SELECT,OUT,,5,,,,YES,YES,ALL,,,YES,TER,,,NO,,,,NO,,,,,,,,,,,,,,,,,,,,,,,
Alternate,Other & Multiple,Chair's text + Less ambitious overfished ,10/21/21 - Text updated. - NEED GNI/OTHER FOR OCOF 5/13/21 - Text updated. ,Chair's text - Consolidated text,Chair's text - Consolidated text (Dec 2020) [Relevant Authorities],18-Dec-20,RD/TN/RL/126/Rev.2 | Relevant Authorities,No,Chair's draft consolidated text,Draft consolidated text (Dec 2020),"This communication aims to consolidate all existing texts that have been put forth or discussed with regards to a prohibition on subsidies. It was intended to provide a starting point for interactive discussion. As written, it provides two possible ways of characterizing and determining what constitutes an overfished stock: i) those recognized as such by the Member under whose jurisdiction the fishing is taking place or by the relevant RFMO/A; ii) those for which the mortality from fishing needs to be restricted to allow the stock to rebuild to some reference point. Additionally, it includes a blank placeholder for inclusion of a cap-based proposal.","<ol><li>Final determinations are made by existing RFMO/A vessel lists, by flag, subsidizing, coastal, and port Member states.</li><li>No publicly available data exist for most flag and subsidizing Members, nor for coastal Members. The possible effects of modeling this proposal is therefore a conservative interpretation of this text. Users are free to explore a more ambitious interpretation by making their own assumptions about the expected IUU-findings.</li><li>No proportionality or the duration of prohibition is considered.</li></ol> ",Subsidies granted by developing and LDC Members shall be allowed for small-scale fishing within their own territorial waters.,"<ol><li>There is uncertainty regarding the status of many fish stocks.</li><li>For the purposes of modeling this proposal, we assume that subsidies to fishing on stocks identified as overfished (B/Bmsy < 0.8) in the RAM Legacy Stock Assessment Database are prohibited.</li><li>The proportion of stocks identified as overfished in the RAM Legacy Stock Assessment Database likely underestimates the actual proportion of stocks that are overfished globally, but it is unclear whether enough evidence would exist to trigger this prohibition for stocks not included in this database.</li><li>The proposal is ambiguous about which reference point might be used to make an overfished determination, and we therefore note that this is only one possible interpretation of this text.</li><li>Additionally, as written, this text includes two alternative definitions used to identify an overfished stock - this is the less ambitious interpretation of the two (see Overfished - Negative effects (Option A)).</li></ol>",Subsidies granted by developing and LDC Members shall be allowed for fishing within their own territorial waters.,"<ol><li>We assume that all capacity-enhancing and ambiguous subsidies as defined by Sumaila et al. (2019) are prohibited to vessels fishing in areas beyond that Member's national jurisdiction.</li><li>We note that this is an ambitious interpretation of this proposal, as the text makes it clear that the fact that a subsidy is granted is not reason enough for that subsidy to be prohibited. However, data does not exist at present to make this determination for subsidy programs globally.</li><li>By default, we consider all capacity-enhancing subsidies provided to vessels spending at least 5% of their total annual effort fishing on the high seas and/or in the EEZs of another coastal state to be prohibited.</li></ol>","Subsidies granted by LDCs shall be allowed, and subsidies granted by developing countries shall be allowed for fishing in their territorial seas, or for fishing in their EEZs and high seas unless any of the following conditions are met for three consecutive years (2016-2018): a) GNI per capita is greater than US $5000 (constant 2010 US$), b) they engage in distant water fishing, or c) the contribution from Agriculture, Forestry and Fishing to their national GDP (World Bank) is greater than 10%.",No,"IUU1, IUU2, IUU3, IUU4, IUU5",NO,,ALL,,,YES,YES,TER,,YES,TER,,NO,,,OA2,SELECT,ALL,,,,,,YES,YES,TER,,,YES,TER,,,NO,,,,"B1, B2, B3, B4, B5, B6, B7, C1, C2, C3",SELECT,OUT,,5,,,,YES,YES,ALL,,,YES,TER,,,NO,,,,NO,,,,,,,,,,,,,,,,,,,,,,,
Alternate,Other & Multiple,Chair's text + China proposal + More ambitious overfished ,10/21/21 - Text updated. - NEED GNI/OTHER FOR OCOF 5/13/21 - Text updated. ,Chair's text - Consolidated text,Chair's text - Consolidated text (Dec 2020) [Objective Definition + CAP - Optional criteria],18-Dec-20,RD/TN/RL/126/Rev.2 | Objective Definition + TN/RL/GEN/199,No,Chair's draft consolidated text,Draft consolidated text (Dec 2020),"This communication aims to consolidate all existing texts that have been put forth or discussed with regards to a prohibition on subsidies. It was intended to provide a starting point for interactive discussion. As written, it provides two possible ways of characterizing and determining what constitutes an overfished stock: i) those recognized as such by the Member under whose jurisdiction the fishing is taking place or by the relevant RFMO/A; ii) those for which the mortality from fishing needs to be restricted to allow the stock to rebuild to some reference point. Additionally, it includes a blank placeholder for inclusion of a cap-based proposal.","<ol><li>Final determinations are made by existing RFMO/A vessel lists, by flag, subsidizing, coastal, and port Member states.</li><li>No publicly available data exist for most flag and subsidizing Members, nor for coastal Members. The possible effects of modeling this proposal is therefore a conservative interpretation of this text. Users are free to explore a more ambitious interpretation by making their own assumptions about the expected IUU-findings.</li><li>No proportionality or the duration of prohibition is considered.</li></ol> ",Subsidies granted by developing and LDC Members shall be allowed for small-scale fishing within their own territorial waters.,"<ol><li>There is uncertainty regarding the status of many fish stocks.</li><li>For the purposes of modeling this proposal, we assume that subsidies to fishing on stocks identified as overfished (B/Bmsy < 1) in the RAM Legacy Stock Assessment Database are prohibited.</li><li>The proportion of stocks identified as overfished in the RAM Legacy Stock Assessment Database likely underestimates the actual proportion of stocks that are overfished globally, but it is unclear whether enough evidence would exist to trigger this prohibition for stocks not included in this database.</li><li>The proposal is ambiguous about which reference point might be used to make an overfished determination, and we therefore note that this is only one possible interpretation of this text.</li><li>Additionally, as written, this text includes two alternative definitions used to identify an overfished stock - this is the more ambitious interpretation of the two (see OFOC - Negative effects (Option A)).</li></ol>",Subsidies granted by developing and LDC Members shall be allowed for fishing within their own territorial waters.,"<ol><li>We assume that all capacity-enhancing and ambiguous subsidies as defined by Sumaila et al. (2019) are prohibited to vessels fishing in areas beyond that Member's national jurisdiction.</li><li>We note that this is an ambitious interpretation of this proposal, as the text makes it clear that the fact that a subsidy is granted is not reason enough for that subsidy to be prohibited. However, data does not exist at present to make this determination for subsidy programs globally.</li><li>By default, we consider all capacity-enhancing subsidies provided to vessels spending at least 5% of their total annual effort fishing on the high seas and/or in the EEZs of another coastal state to be prohibited.</li></ol>","Subsidies granted by LDCs shall be allowed, and subsidies granted by developing countries shall be allowed for fishing in their territorial seas, or for fishing in their EEZs and high seas unless any of the following conditions are met for three consecutive years (2016-2018): a) GNI per capita is greater than US $5000 (constant 2010 US$), b) they engage in distant water fishing, or c) the contribution from Agriculture, Forestry and Fishing to their national GDP (World Bank) is greater than 10%.",<ol><li>We assume each Member's cap is equal to whichever of the three proposed approaches for calculating their cap yields the largest amount.</li><li>Caps based on the first approach are calculated as 55% of each Member's base for capping; caps based on the second approach are calculated as 2% of each Member's estimated landed value calculated from the FAO Global Marine Capture Production Database (average between 2016-2018); caps based on the third approach are calculated as 55% of the global average subsidies per fisher (capacity-enhancing and ambiguous) multiplied by each Member's most recently reported total number of fishers from the FAO Yearbook of Fishery and Aquaculture Statistics (2017).</li><li>We assume that provisioning of the following types of subsidies as defined by Sumaila et al. (2019) are allowed to continue irrespective of a Member's total cap: i) subsidies for fishing access agreements; ii) fisher assistance programs; iii) vessel buyback programs; iv) rural fishers' community development programs. Therefore each Member's base for capping is represented by the total amount of all other capacity-enhancing and ambiguous subsidies estimated by Sumaila et al. (2019).</li><li>LDCs are exempted from the capping and reduction commitments.</li></ol>,"IUU1, IUU2, IUU3, IUU4, IUU5",NO,,ALL,,,YES,YES,TER,,YES,TER,,NO,,,OA1,SELECT,ALL,,,,,,YES,YES,TER,,,YES,TER,,,NO,,,,"B1, B2, B3, B4, B5, B6, B7, C1, C2, C3",SELECT,OUT,,5,,,,YES,YES,ALL,,,YES,TER,,,NO,,,,YES,"B1, B2, B3, B4, B5, B7",ONE,,,,BEST,,,55,2.1,55,,,,,,,,,,,,
