Alternate,Other & Multiple,Chair's text + Phillipines proposal + Less ambitious overfished ,10/22/22 - Text updated. 5/13/21 - Text updated.,Chair's text - Consolidated text,Chair's text - Consolidated text (Dec 2020) [Relevant Authorities + CAP - De minimis],18-Dec-20,RD/TN/RL/126/Rev.2 | Relevant Authorities + RD/TN/RL/81,No,Chair's draft consolidated text,Draft consolidated text (Dec 2020),"This communication aims to consolidate all existing texts that have been put forth or discussed with regards to a prohibition on subsidies. It was intended to provide a starting point for interactive discussion. As written, it provides two possible ways of characterizing and determining what constitutes an overfished stock: i) those recognized as such by the Member under whose jurisdiction the fishing is taking place or by the relevant RFMO/A; ii) those for which the mortality from fishing needs to be restricted to allow the stock to rebuild to some reference point. Additionally, it includes a blank placeholder for inclusion of a cap-based proposal.","<ol><li>Final determinations are made by existing RFMO/A vessel lists, by flag, subsidizing, coastal, and port Member states.</li><li>No publicly available data exist for most flag and subsidizing Members, nor for coastal Members. The possible effects of modeling this proposal is therefore a conservative interpretation of this text. Users are free to explore a more ambitious interpretation by making their own assumptions about the expected IUU-findings.</li><li>No proportionality or the duration of prohibition is considered.</li></ol> ",Subsidies granted by developing and LDC Members shall be allowed for small-scale fishing within their own territorial waters.,"<ol><li>There is uncertainty regarding the status of many fish stocks.</li><li>For the purposes of modeling this proposal, we assume that subsidies to fishing on stocks identified as overfished (B/Bmsy < 0.8) in the RAM Legacy Stock Assessment Database are prohibited.</li><li>The proportion of stocks identified as overfished in the RAM Legacy Stock Assessment Database likely underestimates the actual proportion of stocks that are overfished globally, but it is unclear whether enough evidence would exist to trigger this prohibition for stocks not included in this database.</li><li>The proposal is ambiguous about which reference point might be used to make an overfished determination, and we therefore note that this is only one possible interpretation of this text.</li><li>Additionally, as written, this text includes two alternative definitions used to identify an overfished stock - this is the less ambitious interpretation of the two (see Overfished - Negative effects (Option A)).</li></ol>",Subsidies granted by developing and LDC Members shall be allowed for fishing within their own territorial waters.,"<ol><li>We assume that all capacity-enhancing and ambiguous subsidies as defined by Sumaila et al. (2019) are prohibited to vessels fishing in areas beyond that Member's national jurisdiction.</li><li>We note that this is an ambitious interpretation of this proposal, as the text makes it clear that the fact that a subsidy is granted is not reason enough for that subsidy to be prohibited. However, data does not exist at present to make this determination for subsidy programs globally.</li><li>By default, we consider all capacity-enhancing subsidies provided to vessels spending at least 5% of their total annual effort fishing on the high seas and/or in the EEZs of another coastal state to be prohibited.</li></ol>","Subsidies granted by LDCs shall be allowed, and subsidies granted by developing countries shall be allowed for fishing in their territorial seas, or for fishing in their EEZs and high seas unless any of the following conditions are met for three consecutive years (2016-2018): a) GNI per capita is greater than US $5000 (constant 2010 US$), b) they engage in distant water fishing, or c) the contribution from Agriculture, Forestry and Fishing to their national GDP (World Bank) is greater than 10%.","<ol><li>We assume that provisioning of the following types of subsidies as defined by Sumaila et al. (2019) are allowed to continue irrespective of a Member's total de minimus limit: i) fisher assistance programs; ii) rural fishers' community development program subsidies (both programs relevant to fishing in territorial waters). Therefore each Member's base subsidy level is represented by the total amount of all other capacity-enhancing and ambiguous subsidies estimated by Sumaila et al. (2019).</li><li>We estimate the landed value of marine capture fisheries from the FAO Global Capture Production Database.</li><li>We assume the de minimis limit for developed and developing country members belonging to the top 10 marine capture fisheries producers to be 10% of the average total landed value of the Member's marine capture fisheries between 2016-2018. For all other developing country Members, we assume the de minimis limit to be 20% of the average total landed value between 2016-2018. For LDC Members, we assume the de minimis limit to be 30% of the average total landed value between 2016-2018.</li></ol>","IUU1, IUU2, IUU3, IUU4, IUU5",NO,,ALL,,,NO,,,,,,,,,,OA2,SELECT,ALL,,,,,,YES,YES,TER,,,YES,TER,,,NO,,,,"B1, B2, B3, B4, B5, B6, B7, C1, C2, C3",SELECT,OUT,,5,,,,NO,,,,,,,,,,,,,YES,"B1, B2, B3, B4, B5, B6, B7, C2",THREE,TOP10,,,PERCENT_REV,,10,,,,PERCENT_REV,,20,,,,PERCENT_REV,,30,,,
Alternate,Other & Multiple,Chair's text + Brazil proposal + More ambitious overfished ,10/22/22 - Text updated. 5/13/21 - Text updated.,Chair's text - Consolidated text,Chair's text - Consolidated text (Dec 2020) [Objective Definition + CAP - Formula],18-Dec-20,RD/TN/RL/126/Rev.2 | Objective Definition + RD/TN/RL/124,No,Chair's draft consolidated text,Draft consolidated text (Dec 2020),"This communication aims to consolidate all existing texts that have been put forth or discussed with regards to a prohibition on subsidies. It was intended to provide a starting point for interactive discussion. As written, it provides two possible ways of characterizing and determining what constitutes an overfished stock: i) those recognized as such by the Member under whose jurisdiction the fishing is taking place or by the relevant RFMO/A; ii) those for which the mortality from fishing needs to be restricted to allow the stock to rebuild to some reference point. Additionally, it includes a blank placeholder for inclusion of a cap-based proposal.","<ol><li>Final determinations are made by existing RFMO/A vessel lists, by flag, subsidizing, coastal, and port Member states.</li><li>No publicly available data exist for most flag and subsidizing Members, nor for coastal Members. The possible effects of modeling this proposal is therefore a conservative interpretation of this text. Users are free to explore a more ambitious interpretation by making their own assumptions about the expected IUU-findings.</li><li>No proportionality or the duration of prohibition is considered.</li></ol> ",Subsidies granted by developing and LDC Members shall be allowed for small-scale fishing within their own territorial waters.,"<ol><li>There is uncertainty regarding the status of many fish stocks.</li><li>For the purposes of modeling this proposal, we assume that subsidies to fishing on stocks identified as overfished (B/Bmsy < 1) in the RAM Legacy Stock Assessment Database are prohibited.</li><li>The proportion of stocks identified as overfished in the RAM Legacy Stock Assessment Database likely underestimates the actual proportion of stocks that are overfished globally, but it is unclear whether enough evidence would exist to trigger this prohibition for stocks not included in this database.</li><li>The proposal is ambiguous about which reference point might be used to make an overfished determination, and we therefore note that this is only one possible interpretation of this text.</li><li>Additionally, as written, this text includes two alternative definitions used to identify an overfished stock - this is the more ambitious interpretation of the two (see OFOC - Negative effects (Option A)).</li></ol>",Subsidies granted by developing and LDC Members shall be allowed for fishing within their own territorial waters.,"<ol><li>We assume that all capacity-enhancing and ambiguous subsidies as defined by Sumaila et al. (2019) are prohibited to vessels fishing in areas beyond that Member's national jurisdiction.</li><li>We note that this is an ambitious interpretation of this proposal, as the text makes it clear that the fact that a subsidy is granted is not reason enough for that subsidy to be prohibited. However, data does not exist at present to make this determination for subsidy programs globally.</li><li>By default, we consider all capacity-enhancing subsidies provided to vessels spending at least 5% of their total annual effort fishing on the high seas and/or in the EEZs of another coastal state to be prohibited.</li></ol>","Subsidies granted by LDCs shall be allowed, and subsidies granted by developing countries shall be allowed for fishing in their territorial seas, or for fishing in their EEZs and high seas unless any of the following conditions are met for three consecutive years (2016-2018): a) GNI per capita is greater than US $5000 (constant 2010 US$), b) they engage in distant water fishing, or c) the contribution from Agriculture, Forestry and Fishing to their national GDP (World Bank) is greater than 10%.",<ol><li>We assume each Member's baseline to be the total magnitude of capacity-enhancing and ambiguous subsidies estimated by Sumaila et al. (2019).</li><li>The formula ranges and percentages of reduction from the proposal are then applied to all Members.</li></ol>,"IUU1, IUU2, IUU3, IUU4, IUU5",NO,,ALL,,,NO,,,,,,,,,,OA1,SELECT,ALL,,,,,,YES,YES,TER,,,YES,TER,,,NO,,,,"B1, B2, B3, B4, B5, B6, B7, C1, C2, C3",SELECT,OUT,,5,,,,NO,,,,,,,,,,,,,YES,"B1, B2, B3, B4, B5, B6, B7, C1, C2, C3",ONE,,,,BRAZIL,,,,,,,,,,,,,,,,,
Alternate,Other & Multiple,Chair's text + Brazil proposal + Less ambitious overfished ,10/22/22 - Text updated. 5/13/21 - Text updated.,Chair's text - Consolidated text,Chair's text - Consolidated text (Dec 2020) [Relevant Authorities + CAP - Formula],18-Dec-20,RD/TN/RL/126/Rev.2 | Relevant Authorities + RD/TN/RL/124,No,Chair's draft consolidated text,Draft consolidated text (Dec 2020),"This communication aims to consolidate all existing texts that have been put forth or discussed with regards to a prohibition on subsidies. It was intended to provide a starting point for interactive discussion. As written, it provides two possible ways of characterizing and determining what constitutes an overfished stock: i) those recognized as such by the Member under whose jurisdiction the fishing is taking place or by the relevant RFMO/A; ii) those for which the mortality from fishing needs to be restricted to allow the stock to rebuild to some reference point. Additionally, it includes a blank placeholder for inclusion of a cap-based proposal.","<ol><li>Final determinations are made by existing RFMO/A vessel lists, by flag, subsidizing, coastal, and port Member states.</li><li>No publicly available data exist for most flag and subsidizing Members, nor for coastal Members. The possible effects of modeling this proposal is therefore a conservative interpretation of this text. Users are free to explore a more ambitious interpretation by making their own assumptions about the expected IUU-findings.</li><li>No proportionality or the duration of prohibition is considered.</li></ol> ",Subsidies granted by developing and LDC Members shall be allowed for small-scale fishing within their own territorial waters.,"<ol><li>There is uncertainty regarding the status of many fish stocks.</li><li>For the purposes of modeling this proposal, we assume that subsidies to fishing on stocks identified as overfished (B/Bmsy < 0.8) in the RAM Legacy Stock Assessment Database are prohibited.</li><li>The proportion of stocks identified as overfished in the RAM Legacy Stock Assessment Database likely underestimates the actual proportion of stocks that are overfished globally, but it is unclear whether enough evidence would exist to trigger this prohibition for stocks not included in this database.</li><li>The proposal is ambiguous about which reference point might be used to make an overfished determination, and we therefore note that this is only one possible interpretation of this text.</li><li>Additionally, as written, this text includes two alternative definitions used to identify an overfished stock - this is the less ambitious interpretation of the two (see Overfished - Negative effects (Option A)).</li></ol>",Subsidies granted by developing and LDC Members shall be allowed for fishing within their own territorial waters.,"<ol><li>We assume that all capacity-enhancing and ambiguous subsidies as defined by Sumaila et al. (2019) are prohibited to vessels fishing in areas beyond that Member's national jurisdiction.</li><li>We note that this is an ambitious interpretation of this proposal, as the text makes it clear that the fact that a subsidy is granted is not reason enough for that subsidy to be prohibited. However, data does not exist at present to make this determination for subsidy programs globally.</li><li>By default, we consider all capacity-enhancing subsidies provided to vessels spending at least 5% of their total annual effort fishing on the high seas and/or in the EEZs of another coastal state to be prohibited.</li></ol>","Subsidies granted by LDCs shall be allowed, and subsidies granted by developing countries shall be allowed for fishing in their territorial seas, or for fishing in their EEZs and high seas unless any of the following conditions are met for three consecutive years (2016-2018): a) GNI per capita is greater than US $5000 (constant 2010 US$), b) they engage in distant water fishing, or c) the contribution from Agriculture, Forestry and Fishing to their national GDP (World Bank) is greater than 10%.",<ol><li>We assume each Member's baseline to be the total magnitude of capacity-enhancing and ambiguous subsidies estimated by Sumaila et al. (2019).</li><li>The formula ranges and percentages of reduction from the proposal are then applied to all Members.</li></ol>,"IUU1, IUU2, IUU3, IUU4, IUU5",NO,,ALL,,,NO,,,,,,,,,,OA2,SELECT,ALL,,,,,,YES,YES,TER,,,YES,TER,,,NO,,,,"B1, B2, B3, B4, B5, B6, B7, C1, C2, C3",SELECT,OUT,,5,,,,NO,,,,,,,,,,,,,YES,"B1, B2, B3, B4, B5, B6, B7, C1, C2, C3",ONE,,,,BRAZIL,,,,,,,,,,,,,,,,,
No,Other & Multiple,,"10/22/22 - Text updated. 5/13/21 - NEW, included for reference now, can't model.",Cameroon - Amendments,Various text amendments,19-Feb-21,RD/TN/RL/135,No,Cameroon,Various amendments,"This communication proposes a set of amendments to the Chair's text: 1) Article 1.2 - exclusion of artisanal and small-scale fisheries from scope with transparency requirements; 2) Article 3.2.b - determination of flag states in the high seas; 3) sustainability test of Article 5.2 subject to all members approval and for a 3 year period if members demonstrate that stock is biologically sustainable; 4) Article 9 - Revision of the agreement and termination of the agreement. These amendments cannot be modeled in our framework, and this text is only included for reference. ",<br>,,<br>,,<br>,,,,,,,,,,,,,,,,,,,,,,,,,,,,,,,,,,,,,,,,,,,,,,,,,,,,,,,,,,,,,,,,,,,,,,,,,,,,,,,,,,,,
Yes,Other & Multiple,Applying the Ecuador et al. exemptions to old Chair's text. ,"Need to add conditional developing country S&DT - maybe also reread this one to make sure we have the assumptions correct. 10/22/22 - Text updated. 5/25/21 - Updates. As compared to the old Chair's text, this does do something different for Overfished, but not for OFOC. 5/13/21 - NEW. Need guidance on which Chair's text to apply it to. ",Ecuador - Artisanal,Artisanal - Exemption,22-Feb-21,RD/TN/RL/136,No,"Ecuador, Argentina, and Chile",Proposal on Artisanal Fisheries,"This proposal excludes subsidies to artisanal fisheries from the prohibitions of Articles 4 and 5. The criteria to consider the exemption is low income, resource poor or livelihood fishing to ensure food security and limited to 12 nautical miles and applicable domestic legislation. To model the possible effects of this proposal, we use the prohibition disciplines proposed in the Chair's text - Consolidated text (Dec 2020) [Relevant Authorities - No cap] (excluding any S&DT).","<ol><li>Final determinations are made by existing RFMO/A vessel lists, by flag, subsidizing, coastal, and port Member states.</li><li>No publicly available data exist for most flag and subsidizing Members, nor for coastal Members. The possible effects of modeling this proposal is therefore a conservative interpretation of this text. Users are free to explore a more ambitious interpretation by making their own assumptions about the expected IUU-findings.</li><li>No proportionality or the duration of prohibition is considered.</li></ol> ",Subsidies granted by developing and LDC Members shall be allowed for small-scale fishing within their own territorial waters. A transition period is considered as an alternative but is not modeled here. ,"<ol><li>There is uncertainty regarding the status of many fish stocks.</li><li>For the purposes of modeling this proposal, we assume that subsidies to fishing on stocks identified as overfished (B/Bmsy < 0.8) in the RAM Legacy Stock Assessment Database are prohibited.</li><li>The proportion of stocks identified as overfished in the RAM Legacy Stock Assessment Database likely underestimates the actual proportion of stocks that are overfished globally, but it is unclear whether enough evidence would exist to trigger this prohibition for stocks not included in this database.</li><li>The proposal is ambiguous about which reference point might be used to make an overfished determination, and we therefore note that this is only one possible interpretation of this text.</li><li>Additionally, as written, this text includes two alternative definitions used to identify an overfished stock - this is the less ambitious interpretation of the two (see Overfished - Negative effects (Option A)).</li></ol>",Subsidies granted by all Members shall be allowed for fishing within their own territorial waters.,"<ol><li>We assume that all capacity-enhancing and ambiguous subsidies as defined by Sumaila et al. (2019) are prohibited to vessels fishing in areas beyond that Member's national jurisdiction.</li><li>We note that this is an ambitious interpretation of this proposal, as the text makes it clear that the fact that a subsidy is granted is not reason enough for that subsidy to be prohibited. However, data does not exist at present to make this determination for subsidy programs globally.</li><li>By default, we consider all capacity-enhancing subsidies provided to vessels spending at least 5% of their total annual effort fishing on the high seas and/or in the EEZs of another coastal state to be prohibited.</li></ol>","Subsidies granted by LDCs shall be allowed, and subsidies granted by all other Members shall be allowed for fishing in their territorial seas. Subsidies granted by developing country Members for fishing in their EEZs and high seas will be allowed unless any of the following conditions are met for three consecutive years (2016-2018): a) GNI per capita is greater than US $5000 (constant 2010 US$), b) they engage in distant water fishing, or c) the contribution from Agriculture, Forestry and Fishing to their national GDP (World Bank) is greater than 10%. A transition period is also considered as an alternative but is not modeled here. If a transition period was employed, we assume that LDCs would enjoy a transition period specifically for them. ",No,"IUU1, IUU2, IUU3, IUU4, IUU5",NO,,ALL,,,YES,YES,TER,,YES,TER,,NO,,,OA2,SELECT,EX_TER,,,,,,NO,NO,,,,NO,,,,NO,,,,"B1, B2, B3, B4, B5, B6, B7, C1, C2, C3",SELECT,OUT,,5,,,,YES,YES,ALL,,,YES,TER,,,NO,,,,NO,,,,,,,,,,,,,,,,,,,,,,,
Yes,Other & Multiple,NEW Chair's text,NEED TO UPDATE OFOC S&DT SCOPE. 10/22/22 - Updated text. 7/13/21 - Updated text again. 6/8/21 - Updated text. 5/25/21 - NEW. ,Chair's text - Consolidated text,Chair's text - Consolidated text (June 2021) [Full exemption],11-May-21,TN/RL/W/276/Rev.1 | Full exemption,Yes,Chair's draft consolidated text,Draft consolidated text (June 2021),"This communication aims to represent the progress made since the last consolidated text was released, and to provide some suggested compromises on remaining outstanding issues. As written, it still provides two possible options for S&DT for Article 5 prohibitions. For the purposes of modeling here, we use ALT 1.  ","<ol><li>Final determinations are made by existing RFMO/A vessel lists, and by flag and coastal Member states.</li><li>No publicly available data exist for most flag or coastal Members. The possible effects of modeling this proposal is therefore a conservative interpretation of this text. Users are free to explore a more ambitious interpretation by making their own assumptions about the expected IUU-findings.</li><li>No proportionality or the duration of prohibition is considered.</li></ol>","Subsidies granted by developing and LDC Members shall be allowed for small-scale fishing within their own territorial waters. As written, this exemption might only apply with a transition period, but for the purposes of modeling we assume it to apply indefinitely.","<ol><li>There is uncertainty regarding the status of many fish stocks.</li><li>For the purposes of modeling this proposal, we assume that subsidies to fishing on stocks identified as overfished (B/Bmsy < 0.8) in the RAM Legacy Stock Assessment Database are prohibited.</li><li>The proportion of stocks identified as overfished in the RAM Legacy Stock Assessment Database likely underestimates the actual proportion of stocks that are overfished globally, but it is unclear whether enough evidence would exist to trigger this prohibition for stocks not included in this database.</li><li>The proposal is ambiguous about which reference point might be used to make an overfished determination, and we therefore note that this is only one possible interpretation of this text.</li><li>The definition for an overfished stock subsidy prohibition considered here is the less ambitious interpretation considered in the previous version of the Chair’s text - Consolidated text (December 2020) (see Overfished - Negative effects (Option A)).</li></ol>","Subsidies granted by developing and LDC Members shall be allowed for fishing within their own territorial waters. As written, this exemption might only apply with a transition period, but for the purposes of modeling we assume it to apply indefinitely.","<ol><li>As written, this text would prohibit all capacity-enhancing and ambiguous subsidies as defined by Sumaila et al. (2019) unless a Member can demonstrate that measures are implemented to maintain stocks at a biologically sustainable level. It is unclear how many Members would be able to satisfy this sustainability criteria, and thus we assume that such an exemption could be acquired by all Members. We note that this is therefore a conservative interpretation of this text.</li><li>We assume that all capacity-enhancing and ambiguous subsidies as defined by Sumaila et al. (2019) are prohibited to vessels fishing in areas beyond that Member's national jurisdiction. By default, we consider all capacity-enhancing subsidies provided to vessels spending at least 5% of their total annual effort fishing on the high seas and/or in the EEZs of another coastal state to be prohibited.</li></ol>","Subsidies granted by LDCs shall be allowed, and subsidies granted by developing countries shall be allowed for fishing in their territorial seas, or for fishing in their EEZs and high seas unless any of the following conditions are met for three consecutive years (2016-2018): a) GNI per capita is greater than US $5000 (constant 2010 US$), b) they engage in distant water fishing, or c) the contribution from Agriculture, Forestry and Fishing to their national GDP (World Bank) is greater than 10%. As written, this exemption might only apply with a transition period, but for the purposes of modeling we assume it to apply indefinitely.",No,"IUU1, IUU2, IUU3",NO,,ALL,,,YES,YES,TER,,YES,TER,,NO,,,OA2,SELECT,ALL,,,,,,YES,YES,TER,,,YES,TER,,,NO,,,,"B1, B2, B3, B4, B5, B6, B7, C1, C2, C3",SELECT,OUT,,5,,,,YES,YES,ALL,,,YES,ALL,,,NO,,,,NO,,,,,,,,,,,,,,,,,,,,,,,
